{
  "bundle_id": "00000000-0000-4000-8000-000000000101",
  "version": "0.2.1",
  "created_at": "2026-02-08T10:30:00.000Z",
  "items": [
    {
      "item_id": "item-001",
      "sequence": 0,
      "content_type": "guardspine/audit_event",
      "content": {
        "event_type": "sanitized_bundle_test",
        "message": "Bundle redaction tokens: [HIDDEN:a1b2c3] [HIDDEN:d4e5f6] [HIDDEN:g7h8i9]"
      },
      "content_hash": "sha256:66356ebcff10fc8d8f7e8c528e99c36d32d035a4ef64412c2751ba8364d26096"
    }
  ],
  "immutability_proof": {
    "hash_chain": [
      {
        "sequence": 0,
        "item_id": "item-001",
        "content_type": "guardspine/audit_event",
        "content_hash": "sha256:66356ebcff10fc8d8f7e8c528e99c36d32d035a4ef64412c2751ba8364d26096",
        "previous_hash": "genesis",
        "chain_hash": "sha256:799427b0a09c701ea4695194438e0dd726f7b8e5b63966f2982db018f8174ff9"
      }
    ],
    "root_hash": "sha256:3b992aa4079ef23d98ed0145f983d80c8827ddef4b2944f5d36aea9ecd29a365"
  },
  "sanitization": {
    "engine_name": "pii-shield",
    "engine_version": "1.1.0",
    "method": "deterministic_hmac",
    "token_format": "[HIDDEN:<id>]",
    "salt_fingerprint": "sha256:1a2b3c4d",
    "redaction_count": 3,
    "redactions_by_type": {
      "email": 1,
      "api_key": 2
    },
    "input_hash": "sha256:6f6887b6ecbe5b4f80e99498fa1e1991cecad663f8560d49ace2f73f0f5df0e6",
    "output_hash": "sha256:fbf05f4df43f3f0d4af39f7ca57aa20f8f8da68a2f9d2f356f68d55f49af3c71",
    "applied_to": [
      "ai_prompt",
      "evidence_bundle",
      "sarif"
    ],
    "status": "sanitized"
  },
  "metadata": {
    "retention": {
      "policy": "standard",
      "retention_days": 365
    }
  }
}